{"title":"Outreach Specialist","location":"Barcelona, Spain","date":"18 January 2019","content":"We at\u00a0iBus\u00a0Media\nare looking for\u00a0enthusiastic and highly\nmotivated individuals\u00a0to\u00a0fill\u00a0available\u00a0Outreach Specialist\u00a0positions\u00a0in\u00a0our\u00a0ever-expanding\u00a0Content Marketing and Outreach\u00a0Department\u00a0(CMOD).\u00a0All\u00a0Outreach Specialists\u00a0will work\u00a0directly\u00a0under the supervision of the\u00a0Outreach\u00a0Manager\u00a0to develop and implement\u00a0outreach\u00a0strategies\u00a0in order\u00a0to\u00a0scale existing content marketing and outreach efforts.\u00a0If you are looking to join a talented\u00a0team\u00a0and are looking for an\u00a0opportunity for professional growth please send us your CV and cover letter (in English)\u00a0with subject \u201cOutreach\nSpecialist\u201c.\u00a0\n\u00a0\nDuties and Responsibilities:\u00a0\nB2B Outreach\u00a0Suggest and help implement outreach strategy improvements\u00a0Outreach partner portfolio developmentEnsure content marketing quality standarts and guidelines are being implemented\u00a0\n\u00a0\nEssential\u00a0Skills:\u00a0\nB2B outreach and\/or\u00a0sales experience\u00a0English is\u00a0required. German or Italian languages are a plus.\nA passion for connecting with people and all things internet.\n\u00a0\nDesired Skills:\u00a0\nInbound marketing\n(SEO) knowledge or experience\u00a0A\u00a0good\u00a0understanding of\u00a0SEO and\nweb\u00a0positioning\u00a0metrics\u00a0Experience with web analytic software such as Google Analytics, Open site Explorer, Majestic and SEMrushContent marketing experience\u00a0\n\u00a0\u00a0\n\u00a0Before applying please read\u00a0iBus Media Recruitment Privacy Notice\u00a0carefully.\u00a0\u00a0\nDepartment:\nB2B\n","apply_link":"https:\/\/ibusmedialimited.peoplehr.net\/Pages\/JobBoard\/Opening.aspx?v=6199e30a-b244-44bf-8d5f-d04cfe0ca9c7"}