{"title":"Content Manager","location":"Vilnius, Lithuania","date":"04 April 2019","content":"Are you a good writer? We're currently looking for a highly creative content writer to create and outsource high quality content for our websites.\nPosition offered: Content Manager\u00a0\n\u00a0\nDuties and Responsibilities:\n\u00a0\u00a0\u00a0\u00a0\u00a0\u00a0Write content including features and news articles;\n\u00a0\u00a0\u00a0\u00a0\u00a0\u00a0Edit stories for content, grammar, voice and length;\n\u00a0\u00a0\u00a0\u00a0\u00a0\u00a0Assist with story fact checking;\n\u00a0\u00a0\u00a0\u00a0\u00a0\u00a0Plan and conceptualize editorial content;\n\u00a0\u00a0\u00a0\u00a0\u00a0\u00a0Compiling keyword research and analysis.\n\u00a0\nEssential Skills: \nProven experience in writing, editing, and proof reading;Ability to work under strict deadlines;\u00a0High level of creativity;Excellent communication skills (email, Skype, in-person);\u00a0 \u00a0Professional fluency in English;Optimist.\n\u00a0\nDesired Skills:\nDegree in English Philology\n\u00a0Before applying please read\u00a0iBus Media Recruitment Privacy Notice\u00a0carefully.\u00a0\u00a0\u00a0\nDepartment:\nContent\n","apply_link":"https:\/\/ibusmedialimited.peoplehr.net\/Pages\/JobBoard\/Opening.aspx?v=be984c9f-3922-42af-89e2-425b23e19782"}